ID, Title, Dish-Type, Proteins, Carbs, Fats, Information-String, Sweetness, Saltiness, Sourness, Bitterness, Savoriness, Fattiness, Spiciness 
663559, Tomato and lentil soup, lunch | soup | main course | main dish | dinner, 19g, 55g, 8g, olive oil onion garlic carrots canned tomatoes bay leaf water lentils salt parsley olive oil onion garlic carrots canned tomatoes bay leaf water lentils salt parsley olive oil onion garlic carrots canned tomatoes bay leaf water lentils salt parsley Saut onion and garlic in olive oil for 5 minutes. Add the carrot  saut for another 2 minutes. Add tomatoes  bay leaf and water  stir and bring to the boil. Stir in lentils  season with salt and cook for 5 minutes. Before serving sprinkle with chopped parsley. , 64.26, 100.0, 61.04, 86.23, 32.42, 37.95, 0.0
782600, Quinoa Salad with Vegetables and Cashews, side dish | antipasti | salad | starter | snack | appetizer | antipasto | hor d'oeuvre, 9g, 29g, 39g, brussels sprouts carrots cherry tomatoes dijon mustard garlic lemon (juice) trimmed green kale olive oil parsnip pumpkin seeds cooked dried quinoa raw cashews sesame oil sesame seeds sunflower seeds brussels sprouts carrots cherry tomatoes dijon mustard garlic lemon (juice) trimmed green kale olive oil parsnip pumpkin seeds cooked dried quinoa raw cashews sesame oil sesame seeds sunflower seeds brussels sprouts carrots cherry tomatoes dijon mustard garlic lemon (juice) trimmed green kale olive oil parsnip pumpkin seeds cooked dried quinoa raw cashews sesame oil sesame seeds sunflower seeds Line a baking sheet with parchment paper and preheat an oven to 35 Toss the parsnip  carrots and Brussels sprouts with 1 tablespoon of the olive oil and spread evenly on the pan. Roast for 30 minutes or until tender  stirring the vegetables half way through the cooking time.Meanwhile  toast the cashews  sunflower seeds  pumpkin seeds and sesame seeds in a dry unoiled skillet over medium-low heat for 10 to 15 minutes  tossing frequently  until the cashews and sesame seeds are lighly browned.Toss the kale with the remaining 3 tablespoons of olive oil in a large salad bowl. Fluff the quinoa and add to the bowl along with the roasted vegetables and cherry tomatoes. Whisk together the dressing ingredients. Pour the dressing over the salad and toss. Serve at room temperature or chilled. Sprinkle each serving with a scattering of toasted cashews and seeds. , 34.14, 52.66, 55.66, 52.71, 28.85, 100.0, 30.0
658607, Roasted Mediterranean Vegetable Soup, antipasti | soup | starter | snack | appetizer | antipasto | hor d'oeuvre, 3g, 20g, 10g, oil tomatoes yellow bell peppers. zucchini garlic cloves onion thyme vegetable stock non-dairy creamer like mimiccreme salt and pepper shredded basil leaves oil tomatoes yellow bell peppers. zucchini garlic cloves onion thyme vegetable stock non-dairy creamer like mimiccreme salt and pepper shredded basil leaves oil tomatoes yellow bell peppers. zucchini garlic cloves onion thyme vegetable stock non-dairy creamer like mimiccreme salt and pepper shredded basil leaves Preheat oven to 375 F. Brush a large shallow baking dish with olive oil. Laying them cut-sized down  arrange the tomatoes  bell peppers  zucchini and eggplant in one layer (use two dishes if necessary). Tuck the garlic cloves and onion pieces into the gaps and drizzle the vegetables with the remaining olive oil. Season lightly with salt and pepper and sprinkle with thyme. Place in preheated oven and bake uncovered  for 30-35 minutes  or until soft and browned around the edges. Let cool  then scrape out the eggplant flesh and remove the skin from the bell peppers. Working in batches  put the eggplant and bell pepper flesh  together with the tomatoes  zucchini  garlic and onion place into a bowl and chop together using a knife. Combine the stock and chopped vegetable mixture in a saucepan and simmer over medium heat for 20-30 minutes  until all the vegetables are tender and the flavors have completely blended. Stir in the cream and simmer over low heat for about 5 minutes  stirring occasionally until hot. Taste and adjust the seasoning if needed. Ladle the soup into warm bowls  garnish with basil and serve. , 55.79, 100.0, 49.85, 35.91, 46.75, 53.33, 2.79
658152, Refreshing Strawberry Limeade, beverage | drink, 0.41g, 31g, 0.17g, strawberries sugar lemon lime soda seltzer turbinado sugar lime (juice) limes ice strawberries sugar lemon lime soda seltzer turbinado sugar lime (juice) limes ice strawberries sugar lemon lime soda seltzer turbinado sugar lime (juice) limes ice Add berries and sugar to a bowl and let macerate for about 30 minutes. Add berries to a food processor (or blender) and pulse until smooth. In a large pitcher add ice (about 1/3 of the way)  then top with 2 parts seltzer to one part lemon lime soda. Stir in a few scoops of strawberry puree and add juice from 1 lime. Stir well then taste. Add more strawberry and lime juice if needed. I add thinly slice lime to the pitcher and garnish the glasses with lime wedges and a sugared rim. , 100.0, 0.9, 19.28, 2.75, 0.85, 0.71, 0.0
643505, Fresh Green Bean and Tomato Salad with Creamy Garlic Dressing, side dish | antipasti | salad | starter | snack | appetizer | antipasto | hor d'oeuvre, 6g, 21g, 12g, fresh green beans garlic yellow grape tomatoes black ground pepper olive oil pecans ) red wine vinegar salt shallot spicy brown mustard fresh green beans garlic yellow grape tomatoes black ground pepper olive oil pecans ) red wine vinegar salt shallot spicy brown mustard fresh green beans garlic yellow grape tomatoes black ground pepper olive oil pecans ) red wine vinegar salt shallot spicy brown mustard For the dressing Add all the ingredients to a blender and pulse until smooth. Taste the dressing and season  as needed.Refrigerate for at least 30 minutes.For the salad Refrigerate the clean tomatoes until ready to assemble the salad.Blanch the green beans in boiling water for about three minutes. Drain them and immediately place them in ice water. Once cold  drain and refrigerate until ready to assemble the salad.When ready to serve  add the green beans and tomatoes to a large bowl. Drizzle the chilled dressing over the salad and toss to coat. Serve on individual plates and garnish with the toasted pecans. Add more dressing as desired , 60.71, 100.0, 74.83, 55.25, 56.33, 55.79, 373.5
716415, Butternut Squash & Pear Soup: Real Convenience Food, antipasti | soup | starter | snack | appetizer | antipasto | hor d'oeuvre, 5g, 76g, 14g, butternut squash coconut oil onion pear red pepper flakes salt and pepper vegetable stock butternut squash coconut oil onion pear red pepper flakes salt and pepper vegetable stock butternut squash coconut oil onion pear red pepper flakes salt and pepper vegetable stock , 100.0, 5.73, 22.13, 15.43, 4.34, 25.84, 0.0
633221, Baby Beet Salad, side dish, 3g, 20g, 8g, trimmed yellow red baby beets black pepper fresh mint leaves olive oil red-wine vinegar salt trimmed yellow red baby beets black pepper fresh mint leaves olive oil red-wine vinegar salt trimmed yellow red baby beets black pepper fresh mint leaves olive oil red-wine vinegar salt Scrub the beets well. Wrap groups of 2 or 3 beets together in little packets of aluminum foil. Place the packets on a baking sheet and bake at 350 degrees until very tender  about 1 hour.When the beets are cool enough to handle  slip off and discard the skins (using rubber gloves). Halve beets lengthwise and place in a bowl. Whisk together the oil  vinegar  salt and pepper; toss with the beets. Sprinkle with the mint leaves. , 100.0, 1.35, 0.0, 0.0, 0.0, 71.72, 0.0
635059, Black Bean and Veggie Burgers with Corn Salsa, antipasti | starter | snack | appetizer | antipasto | hor d'oeuvre, 7g, 31g, 1.54g, canned black beans canned corn diced carrot diced celery creole seasoning flour fresh parsley garlic garlic cloves diced green onions black ground pepper black ground pepper red ground pepper diced jalapeño pepper lime (juice) oatmeal diced onion panko breadcrumbs red diced bell pepper salsa salt salt diced tomatoes canned black beans canned corn diced carrot diced celery creole seasoning flour fresh parsley garlic garlic cloves diced green onions black ground pepper black ground pepper red ground pepper diced jalapeño pepper lime (juice) oatmeal diced onion panko breadcrumbs red diced bell pepper salsa salt salt diced tomatoes canned black beans canned corn diced carrot diced celery creole seasoning flour fresh parsley garlic garlic cloves diced green onions black ground pepper black ground pepper red ground pepper diced jalapeño pepper lime (juice) oatmeal diced onion panko breadcrumbs red diced bell pepper salsa salt salt diced tomatoes Mix all the salsa ingredients together (canned corn  jalapeño pepper  tomatoes  green onions  1-2 cloves garlic  fresh parsley  juice of 1 lime  1 tsp salt  1 tsp pepper  1 tsp ground red pepper) and chill for about an hour before serving.Preheat your oven to 425 degrees F. Spray two baking sheets lightly with the nonstick spray and set aside. Add the carrot to a bowl with a little water  cover it and microwave for about two minutes. Once cooled  mash them and add them to the mashed black beans. Mix together then add the remaining vegetables and mix well. Add the oatmeal  breadcrumbs  seasoning and salsa. Mix together until combined. Add the flour and mix well. If the mixture is too moist  add more flour and adjust the seasoning  as needed.Form the mixture into patties and place them on the baking sheets. Bake for about 20 minutes  flipping them halfway through cooking. When the burgers are finished  serve with the Corn Salsa or your favorite topping. , 100.0, 48.28, 84.69, 34.41, 19.18, 25.74, 12.0475
661188, Spicy Seasoned Loaded Guacamole, antipasti | condiment | starter | snack | appetizer | dip | antipasto | hor d'oeuvre | spread, 2.38g, 11g, 15g, avocados lime juice white wine vinegar red onion serrano pepper cilantro diced roma tomato salt black pepper cumin garlic powder avocados lime juice white wine vinegar red onion serrano pepper cilantro diced roma tomato salt black pepper cumin garlic powder avocados lime juice white wine vinegar red onion serrano pepper cilantro diced roma tomato salt black pepper cumin garlic powder In a medium bowl  mash avocado and mix with lime juice and vinegar. Stir in the salt  pepper  cumin  and garlic powder. Mix in red onion  Serrano pepper  cilantro  and chopped tomato. , 23.02, 11.69, 21.2, 5.39, 4.94, 100.0, 9.9
632155, Almond Nut Butter, condiment | dip | spread, 4g, 6g, 10g, raw almonds maple syrup ground cinnamon vanilla extract dark chocolate raw almonds maple syrup ground cinnamon vanilla extract dark chocolate raw almonds maple syrup ground cinnamon vanilla extract dark chocolate Preheat oven to 300 degrees and line a baking sheet with parchment paper. In a large bowl  mix together the almonds and maple syrup . Spread out almond mixture onto baking sheet and bake for 15 minutes  stir and place back in oven for another 15 minutes. Remove from oven and allow the almonds to cool. In food processor add almonds and process until you see it form into a ball.  (NOTE:  You will have to scrape down the sides a few times  like 10.) Add you cinnamon and vanilla extract and then process until drippy.  The whole process takes about 10  15 minutes.   When your right at the end I add the chocolate and process until all melted in  about 1 more minute. Makes about 16 Tablespoons or a smidge over 1 cup Calories per Tablespoon:  92   Fat:  7.4   Sodium:  30   Potassium:  3.3   Carbs:  4.7   Fiber:  1.7   Sugar:  1.8   Protein:  3.1 , 100.0, 83.07, 7.73, 38.29, 1.77, 80.91, 0.0
652417, Moroccan chickpea and lentil stew, lunch | soup | main course | main dish | dinner, 20g, 82g, 7g, broccoli canned chickpeas carrots celery stalks cooked lentils couscous fresh cilantro ground cinnamon ground cumin ground turmeric lemon juice olive oil paprika salt and pepper tomato paste water broccoli canned chickpeas carrots celery stalks cooked lentils couscous fresh cilantro ground cinnamon ground cumin ground turmeric lemon juice olive oil paprika salt and pepper tomato paste water broccoli canned chickpeas carrots celery stalks cooked lentils couscous fresh cilantro ground cinnamon ground cumin ground turmeric lemon juice olive oil paprika salt and pepper tomato paste water Heat oil in large saucepan over medium-high heat  add onion and cook for about 3 minutes. Add celery  carrot and broccoli to pan and saut for about 5 minutes. Add in all seasonings and cook additional 1 minute. Add water  tomato paste  chickpeas and lentils  bring to a boil. Cover  reduce heat to low and simmer for 20 minutes.Meanwhile  cook couscous in separate pan according to package directions. Add cilantro and lemon juice to stew and serve over warm couscous. , 46.44, 100.0, 39.15, 70.11, 54.58, 54.04, 0.0
641005, Cucumber and Cannellini Bean Side Salad, side dish | antipasti | salad | starter | snack | appetizer | antipasto | hor d'oeuvre, 5g, 16g, 5g, canned artichokes black pepper cannellini beans cucumbers fresh basil capers - plus caper juice lemon (juice) olive oil red onion red pepper flakes salt sugar dried sun tomatoes vinegar canned artichokes black pepper cannellini beans cucumbers fresh basil capers - plus caper juice lemon (juice) olive oil red onion red pepper flakes salt sugar dried sun tomatoes vinegar canned artichokes black pepper cannellini beans cucumbers fresh basil capers - plus caper juice lemon (juice) olive oil red onion red pepper flakes salt sugar dried sun tomatoes vinegar Combine all of the ingredients for the salad in a bowl. Combine all of the ingredients for the dressing in a small bowl and mix. Pour the dressing over the salad and give a toss.Refrigerate to chill before serving. , 90.42, 13.09, 63.03, 43.95, 4.66, 100.0, 0.0
637766, Cherry Lime Mojito, beverage | drink, 0.68g, 14g, 0.15g, cherries mint leaves lime demerara sugar white rum carbonated water cherries mint leaves lime demerara sugar white rum carbonated water cherries mint leaves lime demerara sugar white rum carbonated water Place cherries  mint  sugar and lime in a tall glass. Muddle ingredients together at the bottom of the glass. Add a few ice cubes and pour in the rum. Fill the glass the rest of the way with carbonated water and serve. , 76.15, 62.75, 51.7, 100.0, 15.66, 9.94, 0.0
637187, Carrot Cake Snack Bites, None given, 1.46g, 7g, 5g, shredded carrots cinnamon shredded coconut ground ginger medjool dates sunflower seeds walnuts shredded carrots cinnamon shredded coconut ground ginger medjool dates sunflower seeds walnuts shredded carrots cinnamon shredded coconut ground ginger medjool dates sunflower seeds walnuts In a food processor  blend all the snack bite ingredients together.Scoop out tablespoons full of the batter and roll it into a ball. Roll the balls in sesame seeds  coconut  or chopped almonds for additional crunch  if desired.Store refrigerated. , 100.0, 19.65, 16.16, 43.54, 21.92, 44.97, 0.0
644387, Garlicky Kale, side dish, 3g, 10g, 15g, balsamic vinegar garlic curly kale olive oil balsamic vinegar garlic curly kale olive oil balsamic vinegar garlic curly kale olive oil Heat the olive oil in a large pot over medium heat. Add the kale and cover.Stir occasionally until the volume of the kale is reduced by half. Uncover. Add garlic and basalmic.Allow to cook for about another 30 seconds or so  mixing well so that the garlic and vinegar are well distributed. Serve hot. , 27.53, 0.27, 0.0, 0.0, 0.0, 100.0, 0.0
660146, Simple Squash Salad, side dish | antipasti | salad | starter | snack | appetizer | antipasto | hor d'oeuvre, 1.34g, 8g, 0.34g, diced bell pepper black pepper fresh parsley garlic garlic powder capers plus 2 tablespoons caper juice lemon onion dried oregano red pepper flakes salt sugar vinegar diced zucchini diced bell pepper black pepper fresh parsley garlic garlic powder capers plus 2 tablespoons caper juice lemon onion dried oregano red pepper flakes salt sugar vinegar diced zucchini diced bell pepper black pepper fresh parsley garlic garlic powder capers plus 2 tablespoons caper juice lemon onion dried oregano red pepper flakes salt sugar vinegar diced zucchini Combine all of the ingredients the salad ingredients in a bowl. Combine all of the dressing ingredients in a cup and stir  adjust the ingredients to taste. Pour this over the salad and toss. Let the salad sit in the refrigerator for a few hours before serving. , 39.02, 100.0, 32.51, 38.6, 44.04, 34.81, 0.595
658509, Roasted Broccoli with Lemon and Garlic, side dish, 3g, 8g, 2.43g, broccoli florets extra virgin olive oil garlic black ground pepper lemon juice salt broccoli florets extra virgin olive oil garlic black ground pepper lemon juice salt broccoli florets extra virgin olive oil garlic black ground pepper lemon juice salt Preheat the oven to 400 degrees FIn a large bowl  add broccoli florets  olive oil  salt  pepper and garlic. Spread the broccoli out in an even layer on a baking sheet. Bake in the preheated oven until broccoli is tender enough to pierce the stems with a fork  15 to 20 minutes. Remove and place in a bowl  toss with lemon juice. , 26.59, 95.79, 52.67, 100.0, 43.62, 35.0, 0.0
663313, The Pearhattan Cocktail, beverage | drink, 2.54g, 101g, 1.11g, angostura bitters 3 cups fresh ripe usa pears (juice) crème de cassis ice lemon (juice) fresh-squeezed lemon juice freshly usa pear rye whiskey salt angostura bitters 3 cups fresh ripe usa pears (juice) crème de cassis ice lemon (juice) fresh-squeezed lemon juice freshly usa pear rye whiskey salt angostura bitters 3 cups fresh ripe usa pears (juice) crème de cassis ice lemon (juice) fresh-squeezed lemon juice freshly usa pear rye whiskey salt Pour ingredients into shaker and fill with ice. Shake well and serve unstrained  on the rocks. , 100.0, 6.2, 72.33, 51.4, 11.46, 9.23, 0.0
716431, Crockpot Applesauce, antipasti | starter | snack | appetizer | antipasto | hor d'oeuvre, 2.14g, 107g, 1.34g, apples cinnamon lemon (juice) orange juice vanilla apples cinnamon lemon (juice) orange juice vanilla apples cinnamon lemon (juice) orange juice vanilla , 100.0, 1.2, 61.18, 19.73, 5.19, 6.54, 0.0
665029, Watermelon Popsicles with Mint| Basil & Lime, side dish, 0.56g, 6g, 0.13g, basil leaves lime (juice) mint leaves salt watermelon flesh basil leaves lime (juice) mint leaves salt watermelon flesh basil leaves lime (juice) mint leaves salt watermelon flesh Combine basil  lime juice  mint leaves  salt  and cubed watermelon in a blender.  Blend at highest speed until liquefied. Pour into popsicle molds or ice cube tray and freeze for a minimum of 4 hours. Serve. , 100.0, 46.48, 0.0, 0.0, 0.0, 2.75, 0.0
664501, Vegan Taco bowls with Cilantro Lime Cauliflower Rice, lunch | main course | main dish | dinner, 13g, 22g, 48g, avocado oil cauliflower red new mexico chili powder fresh cilantro garlic powder hass avocado fresh jalapeno fresh lime juice onion salt tomato walnuts avocado oil cauliflower red new mexico chili powder fresh cilantro garlic powder hass avocado fresh jalapeno fresh lime juice onion salt tomato walnuts avocado oil cauliflower red new mexico chili powder fresh cilantro garlic powder hass avocado fresh jalapeno fresh lime juice onion salt tomato walnuts Set the nuts to soak in a bowl of water 2-8 hours before preparing the meat.Preheat the oven to 375 F and line a baking sheet with aluminum foil.Finely chop the cauliflower into rice-sized pieces  or pulse in the food processor until the desired consistency. Toss with the oil and spread onto the baking sheet in an even layer. Bake for 18 minutes  stirring halfway through.While the cauliflower rice is cooking  prepare the guacamole and taco meat. Cut the avocado into large chunks and place into a small bowl. Add the lime juice and mash the avocado to a chunky puree or your preferred consistency. Stir in the cilantro  jalapeno  onion and spices. Set aside. Remove the nuts from the water and place into a small food processor. Discard the water. Pulse the nuts until theyve reached a ground meat consistency  I find about 5-7 pulses works. Transfer to a bowl and stir in the salt  cumin  garlic powder  and red chili powder. Set aside.When the cauliflower is done  transfer to a mixing bowl while still warm and stir in the lime  cilantro  and salt.To assemble the bowls  layer 1 cup of the cauliflower rice in a bowl with taco nut meat  a dollop of guacamole  fresh tomatoes  and a sprinkling of fresh cilantro. Serve immediately with an additional slice of lime if desired. , 72.9, 48.55, 53.29, 100.0, 43.07, 95.94, 7.875
716290, Mango Salsa, antipasti | condiment | starter | snack | appetizer | dip | antipasto | hor d'oeuvre | spread, 5g, 74g, 1.95g, cherry tomatoes green bell pepper lime juice mangoes mint leaves red bell pepper red onions sugar cherry tomatoes green bell pepper lime juice mangoes mint leaves red bell pepper red onions sugar cherry tomatoes green bell pepper lime juice mangoes mint leaves red bell pepper red onions sugar Peel and chop your mango into small cubes Cube your bell peppers and onions as well and mix in with the mangoes. Add the cherry tomatoes and mix in.sprinkle your sugar and lime juice over it.Chop your scent/mint leaves and mix in and refrigerate. Serve cool as a side dish or if you want something refreshing on a hot day. , 100.0, 3.82, 52.2, 32.06, 2.42, 34.37, 0.595
631880, 5-Minute Blueberry Chia Jam, condiment | dip | spread, 1.49g, 16g, 2.07g, fresh blueberries chia seeds honey/maple syrup water fresh blueberries chia seeds honey/maple syrup water fresh blueberries chia seeds honey/maple syrup water Add all of the ingredients to your blender with enough water to allow it to blend  and blend. Pour the jam into a glass jar or similar. Store in the fridge. It should last for around 4-5 days. , 100.0, 12.75, 73.03, 50.97, 9.18, 14.71, 0.0
663858, Tropical Ice Pops, dessert, 0.34g, 17g, 3g, unsweetened coconut beverage light coconut milk fresh mango maple syrup fresh pineapple popsicle moulds unsweetened coconut beverage light coconut milk fresh mango maple syrup fresh pineapple popsicle moulds unsweetened coconut beverage light coconut milk fresh mango maple syrup fresh pineapple popsicle moulds Pure the mango  pineapple  3/4 cup coconut beverage and 1 1/2 tablespoon maple syrup in a blender. Pour equal amounts of the mixture into each mould.In a small bowl  mix the coconut milk  1/4 cup of coconut beverage  and 2-3 TBS of maple syrup (adjust the sweetness to your taste). Pour equal amounts of the coconut mixture on top of the fruit pure.Insert a popsicle stick into each of the moulds  leaving about a quarter of the stick above the mould.Freeze the popsicles for about 2 to 3 hours.To remove the ice pops from the moulds  run them under warm to hot water for about 5 to 10 seconds before pulling them out. , 100.0, 0.74, 36.23, 14.62, 7.03, 24.4, 0.0
661653, Stir Fried Cabbage and Tomatoes, antipasti | starter | snack | appetizer | antipasto | hor d'oeuvre, 4g, 22g, 0.5g, beijing cabbage diced tomatoes gloves garlic salt sugar ketchup water beijing cabbage diced tomatoes gloves garlic salt sugar ketchup water beijing cabbage diced tomatoes gloves garlic salt sugar ketchup water Coarsely shred the cabbage and rinse well. Drain and set aside. Rinse tomatoes and dice  set aside. Heat wok with some oil to saute the garlic. Put in the cabbage and cook until soft  add a little water if necessary. Add diced tomatoes and seasoning with 2-3 tablespoons of water into it. Stir fry to combine and serve immediately. , 29.16, 100.0, 62.12, 48.5, 55.65, 29.19, 0.0
775585, Crockpot "Refried" Beans, antipasti | starter | snack | appetizer | antipasto | hor d'oeuvre, 5g, 17g, 0.45g, black pepper cumin canned garlic onion pinto beans up salt water black pepper cumin canned garlic onion pinto beans up salt water black pepper cumin canned garlic onion pinto beans up salt water Rinse the beans in a colander. Pick out any bad beans. Combine all the ingredients in the crockpot. Remove any floating beans. Cover  and cook on HIGH for 4 hours and on LOW for 2 hours.Uncover  and remove extra liquid. Leave enough liquid to reach the desired consistency when the beans are mashed. (We like our beans somewhere between the very-liquidy restaurant style beans  and the canned version of refried beans.)Mash beans with a potato masher to desired consistency. Serve warm. Store in air-tight containers in the refrigerator and use within 2 weeks  or freeze in ziplock bags for later use. , 23.28, 77.22, 36.16, 100.0, 13.37, 9.79, 0.0
