ID, Title, Dish-Type, Proteins, Carbs, Fats, Information-String, Sweetness, Saltiness, Sourness, Bitterness, Savoriness, Fattiness, Spiciness 
637187, Carrot Cake Snack Bites, None given, 1.46g, 7g, 5g, shredded carrots cinnamon shredded coconut ground ginger medjool dates sunflower seeds walnutsshredded carrots cinnamon shredded coconut ground ginger medjool dates sunflower seeds walnutsshredded carrots cinnamon shredded coconut ground ginger medjool dates sunflower seeds walnutsIn a food processor  blend all the snack bite ingredients together.Scoop out tablespoons full of the batter and roll it into a ball. Roll the balls in sesame seeds  coconut  or chopped almonds for additional crunch  if desired.Store refrigerated.,100.0,19.65,16.16,43.54,21.92,44.97,0.0,
795431, Green Bean Poriyal, side dish, 1.05g, 6g, 5g, asafetida brown mustard seeds chana dal coconut oil cumin seeds dried curry leaves red fresh chili sea salt tamarind pulp unsweetened shredded dried coconut split skinned urad dalasafetida brown mustard seeds chana dal coconut oil cumin seeds dried curry leaves red fresh chili sea salt tamarind pulp unsweetened shredded dried coconut split skinned urad dalasafetida brown mustard seeds chana dal coconut oil cumin seeds dried curry leaves red fresh chili sea salt tamarind pulp unsweetened shredded dried coconut split skinned urad dalSoak the tamarind pulp in 2/3 cup boiling water for 40 minutes. Strain the tamarind into a small bowl  pressing down on the pulp to squeeze as much liquid as you can. Set the drained tamarind liquid aside.In a large frying pan or wok  heat the oil over medium heat until hot. Add the mustard seeds and cumin seeds to the pan and cook for a few minutes. Now add the urad and toor or chana dals  chilli  asafetida and curry leaves. Fry for another few minutes until the mustard seeds turn grey and begin to splutter and pop.Now add the green beans  about 3 tablespoons of the tamarind water  and salt. Reduce the heat to medium-low and cover. Cook until the beans are tender  about 5 to 7 minutes. Stir in the coconut and cook for another few minutes. Remove from heat and taste for seasoning. Serve warm alongside some fresh cooked white rice and your favorite dal dishes.,100.0,19.16,16.73,2.41,10.36,50.07,337.5,
660231, Skinny Veggie Fried Rice, side dish | antipasti | starter | snack | appetizer | antipasto | hor d'oeuvre, 5g, 22g, 9g, sesame oil ginger garlic mushrooms baby corns green onions white part size carrot bell pepper low sodium soy sauce salt black bell pepper sesame seedssesame oil ginger garlic mushrooms baby corns green onions white part size carrot bell pepper low sodium soy sauce salt black bell pepper sesame seedssesame oil ginger garlic mushrooms baby corns green onions white part size carrot bell pepper low sodium soy sauce salt black bell pepper sesame seedsHeat a wok or skillet on med-high and add 1 tsp oil. To it add minced ginger and 1 tsp minced garlic. Saute until fragrant but not burnt. Add mushroom pieces. Cook until tender for 5-6 minutes. Keep mushrooms along with any juices aside in a bowl. Heat wok again add 1 tsp oil. To it add remaining garlic. Saute until fragrant and add all the vegetables. Stir it all together on high flame. Add salt  black pepper and splash of soy sauce. Toss to coat and let them cook for few more minutes until they get tender but not soft. You want veggies to be cooked but with a little crunch. Now add the cold already cooked rice and stir it so it all gets mixed together. Do with a gentle hand. Let the rice get warm at med- high flame. Add the remaining 1 tsp oil along with salt  black pepper and soy sauce. Add the mushrooms and tofu(if using). Mix it all together. Toss and taste. Garnish with chopped green parts of green onions and sesame seeds.,59.66,100.0,23.13,46.87,70.32,77.8,0.595,
794350, Cherry Coconut Milk Smoothie, morning meal | brunch | beverage | breakfast | drink, 4g, 38g, 17g, frozen banana fresh cherries coconut milk hemp milk vanillafrozen banana fresh cherries coconut milk hemp milk vanillafrozen banana fresh cherries coconut milk hemp milk vanillaCombine all of the ingredients in a blender and process until smooth. Add a bit more almond or hemp milk if the mixture is too thick.Tip: To freeze bananas for smoothies  peel the banana and cut into slices. Place the slices on a baking sheet lined with parchment paper and freeze. Once frozen  transfer to a freezer-friendly container or freezer bag. The bananas will freeze well for up to 4 to 6 months.,100.0,1.1,43.5,28.27,10.36,46.5,0.0,
775585, Crockpot "Refried" Beans, antipasti | starter | snack | appetizer | antipasto | hor d'oeuvre, 5g, 17g, 0.45g, black pepper cumin canned garlic onion pinto beans up salt waterblack pepper cumin canned garlic onion pinto beans up salt waterblack pepper cumin canned garlic onion pinto beans up salt waterRinse the beans in a colander. Pick out any bad beans. Combine all the ingredients in the crockpot. Remove any floating beans. Cover  and cook on HIGH for 4 hours and on LOW for 2 hours.Uncover  and remove extra liquid. Leave enough liquid to reach the desired consistency when the beans are mashed. (We like our beans somewhere between the very-liquidy restaurant style beans  and the canned version of refried beans.)Mash beans with a potato masher to desired consistency. Serve warm. Store in air-tight containers in the refrigerator and use within 2 weeks  or freeze in ziplock bags for later use.,23.28,77.22,36.16,100.0,13.37,9.79,0.0,
661188, Spicy Seasoned Loaded Guacamole, antipasti | condiment | starter | snack | appetizer | dip | antipasto | hor d'oeuvre | spread, 2.38g, 11g, 15g, avocados lime juice white wine vinegar red onion serrano pepper cilantro diced roma tomato salt black pepper cumin garlic powderavocados lime juice white wine vinegar red onion serrano pepper cilantro diced roma tomato salt black pepper cumin garlic powderavocados lime juice white wine vinegar red onion serrano pepper cilantro diced roma tomato salt black pepper cumin garlic powderIn a medium bowl  mash avocado and mix with lime juice and vinegar. Stir in the salt  pepper  cumin  and garlic powder. Mix in red onion  Serrano pepper  cilantro  and chopped tomato.,23.02,11.69,21.2,5.39,4.94,100.0,9.9,
647830, Indian Lentil Dahl, lunch | main course | main dish | dinner, 17g, 42g, 20g, canola oil cilantro coconut milk fresh ginger garam masala garlic cloves lime juice onion plum tomatoes red split lentils salt watercanola oil cilantro coconut milk fresh ginger garam masala garlic cloves lime juice onion plum tomatoes red split lentils salt watercanola oil cilantro coconut milk fresh ginger garam masala garlic cloves lime juice onion plum tomatoes red split lentils salt waterIn a large saucepan  combine oil  onion and salt at medium-high heat. Cook until onion starts to brown  around 5 minutes or so. Add garlic  ginger and Garam Masala   cook until fragrant  about 1 minute. Add lentils  coconut milk and water. Bring to a boil  then reduce heat to low and simmer  partially covered until lentils are fully tender and broken down to an almost paste-like consistency  about 25-30 minutes. Add lime juice and cilantro. Check for seasoning. Serve (over rice if you like)  topped with the diced tomatoes.,37.05,100.0,43.37,65.47,34.49,72.4,42.0,
