158742, Savory Lentil-Mushroom Burgers, antipasti | starter | snack | appetizer | antipasto | hor d'oeuvre, 10g, 26g, 1.19g, chia seeds cooked green lentils dried basil dried thyme garlic mushrooms gluten-free old fashioned oats onion dried oregano black grating pepper potato starch salt smoked paprika wheat-free tamari tomato paste warm water <<instructions>> Mix the chia seeds and warm water in a small bowl and set aside. Chop the onion finely. Place the mushrooms into the food processor and pulse until they are finely minced. Mince the garlic. Heat a non-stick skillet over medium-high heat. Add the onions and cook until they begin to brown  adding a splash of water if they begin to stick. Stir in the mushrooms and garlic and another splash of water. Cover and cook until the mushrooms soften (about 2-3 minutes)  stirring often.  When the mushrooms have softened  transfer them to the food processor and add the lentils. Pulse until the lentils are just combined with the mushrooms. Add the chia seed mixture and all remaining ingredients and pulse to combine well. It’s okay if a few lentils remain whole  but the mixture should be more sticky than crumbly. If it seems too wet  add a little more oats. Scrape the mixture into a bowl and set aside for about 15 minutes. Preheat the oven to 375F and line a baking sheet with a silicone mat or with parchment paper. Shape the burger mixture into 6 patties  each about 3 inches wide and 3/4 inch thick. Place them on the prepared pan and bake for about 30 minutes. Since ovens can vary  check them after 25 minutes to make sure they are firm in the middle but not burning and give extra time if necessary. Use a spatula to remove the burgers from the baking sheet. Serve at once or refrigerate for later use.,22.12,100.0,15.12,30.29,50.01,47.02,0.0,
542745, Mediterranean Chickpea Burgers, antipasti | starter | snack | appetizer | antipasto | hor d'oeuvre, 8g, 31g, 4g, baby spinach canned chickpeas garlic cloves ground flax ground pepper lemon (juice) lettuce/avocado nutritional yeast whole wheat gluten-free panko breadcrumbs sundried tomatoes <<instructions>> Start by combining the flax and water in a measuring cup and then set it aside to thicken.Next  warm one tablespoon of the oil from the sundried tomatoes in a skillet over low to medium heat. Add the garlic and sauté until fragrant  being careful not to overcook it. Remove from heat and set aside. (To save time  I use a food processor to mince my garlic) Place one can of the drained and rinsed chickpeas into a food processor (or you can mash by hand) and pulse until they are chunky but not pureed  then scoop out into a large bowl. Add the other can of chickpeas to the bowl and set aside.Next  add the spinach to the food processor (or chop by hand) and pulse until it’s finely chopped. Add it to the bowl with the chickpeas.Then add the sundried tomatoes (drained from excess oil)  lemon zest and lemon juice to the processor and pulse until well blended. If you prefer bigger chunks of tomato then don’t blend as long.Alternatively  you can finely chop the tomatoes by hand and add them along with the lemon juice and zest to the bowl with the chickpeas.Scoop the sundried tomato mixture into the bowl along with the sautéed garlic. Mix ingredients together.Lastly  add the flax-water mixture and stir until evenly distributed. Form mixture into separate patties (about 1/4 cup at a time) and set on a flat surface that can be transferred to the refrigerator.Refrigerate for at least 30 minutes before cooking. This helps them set so that they hold together.They can be cooked in a pan over medium heat using the oil from the sundried tomatoes for about 5 minutes on each side or you can bake them at 375°F for 12 minutes on each side.Store in an airtight container in the refrigerator for up to 4 days.,43.03,16.44,100.0,58.0,11.61,47.4,0.0,
250734, Chicago Diner Mushroom Burgers, antipasti | starter | snack | appetizer | antipasto | hor d'oeuvre, 8g, 32g, 2.43g, garlic powder black ground pepper diced mushrooms diced onion onion powder red diced roasted peppers rolled oats salt soy sauce whole wheat flour <<instructions>> Bring 4 cups water  roasted red peppers or celery  onion  soy sauce  onion powder  garlic powder  pepper  and salt to a boil in a pot over medium heat. Reduce heat to medium and simmer 5 minutes. Stir in the oats  mushrooms  and flour and cook 5 minutes more. Transfer to a bowl and chill.Preheat oven to 350°F; coat a baking sheet with cooking spray or line it with a silpat. Shape mixture into patties and bake on prepared baking sheet for 15 minutes. Flip and bake 10 more minutes. Cool. Heat grill to medium-high. place foil on grill and coat with cooking spray. Grill burgers on foil for 7 minutes per side.,23.61,100.0,21.96,32.38,77.35,62.99,0.7,
505316, Cheezy Broccoli Quinoa Burgers, antipasti | starter | snack | appetizer | antipasto | hor d'oeuvre, 5g, 15g, 16g, broccoli stems broccoli florets canned chickpeas cooked quinoa garlic powder nutritional yeast oil ) quinoa flour salt & pepper whole grain mustard <<instructions>> Steam broccoli until tender  either using a steamer basket or just in a small pan with a little water in the bottom. Drain and let cool until cool enough to handle. Once cool  add broccoli to a food processor and pulse until chopped into very small pieces  10 - 15 pulses. Add chickpeas  quinoa and mustard and pulse until a dough starts to form.,16.74,63.73,32.1,38.35,33.56,100.0,90.0,
506584, Chickpea Sunflower Seed Burgers, lunch | main course | main dish | dinner, 16g, 47g, 14g, carrot cooked chickpeas* can chickpeas dried thyme garlic cloves black ground pepper dried oregano raw sunflower seeds red wine vinegar rolled scallion sea salt tahini tamari <<instructions>> Place the oats in a food processor and process until the consistency becomes fine like flour  about 1 minute.Pulse in oregano  cayenne  salt  and pepper. Add carrot  scallion  parsley  garlic  vinegar  tahini  and tamari. Process continuously until mixture becomes uniform  about 1 to 2 minutes.Pulse or stir in sunflower seeds.Shape burger dough into 4 large patties or 6 small patties. Heat a skillet on medium with a tiny splash of oil or cooking spray; Cook patties 6 minutes then flip and continue to cooke another 4 minutes. Remove and serve as desired.,100.0,30.05,7.48,41.21,0.0,88.75,0.0,
761716, Pepita-Sunflower-Sesame Burgers, antipasti | starter | snack | appetizer | antipasto | hor d'oeuvre, 12g, 20g, 25g, cayenne cooked lentils dry plain bread crumbs fresh flat-leaf parsley olive oil pepitas salt green white light scallions sesame seeds sunflower seeds tahini <<instructions>> In food processor  combine sunflower seeds  pepitas and sesame seeds and process until coarsely chopped. Add lentils  scallions  parsley  tahini  salt  cayenne and bread crumbs; process until mixture is blended. Shape mixture into 4 patties and place on platter. Cover and refrigerate 30 minutes. In large skillet  heat oil over medium heat. Cook burgers until golden brown  about 3 minutes per side.,15.09,60.48,6.88,16.1,22.98,100.0,0.4,
613356, Weeknight Vegan Falafel Burgers, antipasti | starter | snack | appetizer | antipasto | hor d'oeuvre, 11g, 66g, 14g, canned garbanzo beans garlic clove dry gluten-free dairy-free bread crumbs gluten-free hamburger buns lemon juice olive oil red onion salt canned spinach tomato <<instructions>> Heat 1 tablespoon olive oil in a 12-inch skillet over medium heat. Add the red onion and garlic and cook for about 5 minutes  until tender-crisp. Remove the vegetables to the bowl of a food processor. Add  of the garbanzo beans to the food processor  along with the lemon juice and salt. Pulse to create a smooth paste. Add the remaining garbanzo beans  bread crumbs and spinach. Pulse until coarsely chopped.Shape the mixture into 4 4-inch patties. If desired  refrigerate until ready to cook. Heat the remaining 1 tablespoon olive oil in a 12-inch skillet over medium heat. Add the falafel patties and cook until golden and crisp  turning once. Serve the falafels on buns and top with tomato  onion and dairy-free tzatziki sauce  as desired.,70.91,33.12,100.0,29.4,21.89,47.91,0.0,
617041, Chickpea Quinoa Pumpkin Burgers, lunch | main course | main dish | dinner, 14g, 33g, 12g, baking powder chickpea flour cooked quinoa cooked dried chickpeas fresh parsley garlic ginger ground cinnamon ground coriander ground cumin ground mace black fresh ground pepper jalapeños paprika red onion roasted pumpkin sea salt sun-dried tomatoes tahini turmeric <<instructions>> Rinse the chickpeas  cover with water  and soak for at least 8 hours or overnight.  Meanwhile  rinse the quinoa and soak in 2/3 cup water overnight in a small saucepan. Drain and rinse the chickpeas  transfer to a medium saucepan  cover with water  and bring to a boil. Reduce the heat to low  cover  and simmer until the beans are soft  about 1 hour.Bring the quinoa to a boil  reduce the heat to low  cover  and simmer until the water has evaporated  about 15 minutes. Set aside to cool.Meanwhile  soak the sun-dried tomatoes in hot water for 20 minutes  then drain and chop.To roast the pumpkin  cut it in half  scoop out the pulp and seeds  and transfer to a baking dish with a small amount of water. Bake in a preheated 350 oven until fork tender  40 to 50 minutes  depending on the size of the pumpkin. Let cool and remove the skin. Mash with a fork or potato masher and set aside.When the chickpeas are cooked  drain and transfer to a food processor. Pulse into a fine meal. Add most of the onion  the garlic  ginger  parsley  jalapeos  sun-dried tomatoes and tahini and pulse until smooth. Put 1 1/2 cups of the roasted and mashed pumpkin in a large bowl. Stir in the chickpea mixture until well combined. Stir in the remaining onion  spices  quinoa  and salt and pepper. Add enough chickpea flour to get a mixture that is moist but dry enough to shape into patties. Chill for 30 to 60 minutes.Line a baking sheet with parchment paper and preheat an oven to 37 Shape the chickpea pumpkin mixture into 2 to 3 inch patties and transfer to the baking sheet. Bake for 15 to 20 minutes per side until golden. Serve as burgers with chutneys or just as they are with your favorite condiments and a side salad.,50.29,55.76,28.13,20.84,28.64,100.0,14.7,
1735807, High-Protein Plant-Based Burgers, lunch | main course | main dish | dinner, 19g, 31g, 17g, tablespoon oil yellow sweet diced onion garlic cloves red diced bell pepper cooked black beans hemp seeds sun-dried tomatoes paprika sea salt chipotle powder cayenne miso paste cooked brown rice quinoa flakes <<instructions>> Heat the 1 teaspoon oil in a nonstick frying pan over medium heat. Add the onion and garlic  and sauté until the onion begins to turn translucent  about 3 to 4 minutes. Add the bell pepper  and continue to cook until the vegetables have softened  about 5 minutes. Reduce the heat to low and add the black beans  hemp seeds  sun-dried tomatoes  paprika  sea salt  chipotle  and cayenne. Sauté for another 1 to 2 minutes. Remove the pan from the heat and transfer the mixture to a large bowl. Add the miso paste  and use a fork to mix the beans and miso together  partially mashing the beans. Mix in the cooked brown rice and quinoa flakes. Let cool. When cool enough to handle  use clean hands to knead the mixture together to form a dense base. Place the base in the refrigerator  covered  for 30 minutes to allow quinoa flakes to swell and absorb the excess moisture. Form the mixture into 8 patties (8 patties if you want them smaller). Heat ½ tablespoon of the remaining oil in your pan over medium heat. Add half of the patties and cook for about 4 to 5 minutes on each side  or until browned. Repeat with the remaining ½ tablespoon oil and patties.,25.86,60.49,7.17,3.85,23.94,100.0,3.12,
1709621, Vegan White Bean Broccoli Burgers, antipasti | starter | snack | appetizer | antipasto | hor d'oeuvre, 9g, 25g, 5g, broccoli florets rolled oats garlic cloves canned white beans nutritional yeast tahini extra virgin olive oil lemon juice dried oregano salt & pepper green onions <<instructions>> Steam the broccoli just until fork tender  for about 7-10 minutes. Set aside to cool. In a food processor  add the oats and pulse to a fine crumb. Add the garlic and continue to pulse until minced. To the processor  add the broccoli  white beans  nutritional yeast  tahini  olive oil  lemon juice  oregano  and salt &amp; pepper. Pulse until everything is finely chopped and evenly combined. You will likely need to stop and scrape down the sides in between pulses. Careful not to over process the ingredients. We don&#39;t want to make hummus. Transfer the mixture to a large bowl then fold in the green onions by hand. Cover and refrigerate for 30 mins to an hour. This helps the mixture to be easier to handle when you shape it into burgers. Preheat the oven to 400°F and line a baking sheet with parchment paper or a silicone mat. Scoop out roughly 1/3 cup of the mixture at a time and use your hands to shape into round patties. Arrange on the baking sheet several inches apart. Bake in the oven for 18-20 minutes  until golden brown on the edges. Serve immediately or allow to cool and refrigerate for up to 1 week or freeze for up to 3 months. I like to reheat them over medium-low on the stovetop with a little bit of olive oil for 3-4 minutes on each side.,27.82,76.42,71.39,100.0,36.43,80.4,0.0,
31693, In A Jiffy Curry Chickpea Burgers, lunch | main course | main dish | dinner, 20g, 57g, 23g, baby carrots black pepper cooked chickpeas coconut oil arvinda's curry masala regular oats paprika parsley flakes pepitas sea salt sunflower seeds tumeric <<instructions>> ,98.59,29.65,8.12,44.73,0.0,100.0,0.0,
621406, Butternut Squash Apple Sage Burgers, antipasti | starter | snack | appetizer | antipasto | hor d'oeuvre, 8g, 40g, 5g, diced apples diced butternut squash dried cranberries dried thyme fresh sage garlic clove black ground pepper groung nutmeg oats oil pumpkin seeds red onion sea salt cooked white beans <<instructions>> Preheat oven to 425F and line a baking sheet with parchment paper. Add squash  onion and apples to baking sheet. Toss with olive oil to coat. Place in oven for 20 minutes  toss with spatula  and return to oven for an addition 15-20 minutes or until the mixture begins to brown. Remove from oven and set aside to use later. Place the oats in the bowl of a food processor. Process until oats become the texture of fine meal or better yet- flour!. Add garlic  sage  thyme  beans  salt  pepper  nutmeg  and roasted mixture to food processor. Pulse a 10-15 times to combine. Scrape down sides if the mixture starts to stick. Pulse or gently stir in pumpkin seeds and cranberries  if using (mixture will be fairly thick). Shape mixture into 6 patties. Heat a medium skillet over medium-high heat. Spray with a non-stick cooking spray. Cook veggie burgers 6 minutes on first side  or until well browned. Flip burgers and continue to cook on other side an additional 4-6 minutes or until that side is well browned as well. Serve warm.,100.0,4.07,40.34,11.87,3.34,25.88,0.0,
902819, BBQ Lentil and Sweet Potato Burgers, antipasti | starter | snack | appetizer | antipasto | hor d'oeuvre, 10g, 42g, 23g, tablespoons barbeque sauce cooked dry brown lentils carrot chili powder dried parsley egg golden flax meal flour garlic cloves red suggested toppings: lettuce olive oil onion dried oregano whole wheat gluten-free panko breadcrumbs pepper salt smoked paprika sunflower seeds sweet potato walnuts <<instructions>> Start by cooking the sweet potato by either microwaving on high for 7-8 minutes or baking in the oven at 400F for about an hour. Set aside and allow to cool.Using a food processor  finely chop the onion  carrots  garlic  walnuts and sunflower seeds then transfer to a large bowl. I prefer to process each ingredient individually to achieve the best texture.Next add the cooked lentils to the food processor and pulse until they appear slightly pureed  then transfer them to the bowl as well. *Be careful not to over process the lentils. You dont want them to turn to mush--there should still be some shape to at least half of them. See picture in the post as an example.Once you have all of the vegetables  lentils  nuts and seeds in the bowl  add the sweet potato  breadcrumbs  herbs/paprika/salt&pepper  and the flax meal then stir everything together.Next pour in the barbeque sauce and the egg or flax egg and stir until well-combined. Sprinkle in the flour a little at a time as you continue to stir. If the mixture seems too wet  add more flour as needed.Form eight individual patties with your hands  making sure to keep them somewhat flat with rounded edges and somewhat smaller than the bun. They will hold together better if they arent too thick or too big. At this point you can refrigerate them until you are ready to cook (for up to 2-3 days) or cook them right away.When youre ready to cook them  start by warming the olive oil over medium-heat in a skillet for at least five minutes. Once the skillet is thoroughly heated  cook the burgers on each side for about 5-6 minutes. I like the push the edges of the burger to the side of the pan as I cook them to make sure they are cooked on the sides as well. Serve on a warm bun with desired toppings and dig in!,41.27,77.93,9.75,25.04,29.84,100.0,0.0,
494424, Balsamic Portobello Burgers, antipasti | starter | snack | appetizer | antipasto | hor d'oeuvre, 7g, 39g, 17g, balsamic vinegar garlic olive oil portobello mushrooms sourdough rolls <<instructions>> Combine vinegar  oil  garlic  and pepper in a small bowl. Place portobellos upside down  in a shallow bowl and pour marinade over them. Marinate for 30 minutes while you heat the grill.Once the grill is nice and hot  place mushrooms  top-down on the grill grates. Cover  and grill mushrooms for 2-3 minutes  just until marks begin to show.Flip mushrooms and grill the second side for 2-3 minutes.When mushrooms are nice and hot  place on a split sourdough roll and top with additional veggies as desired.Be sure to have an extra napkin handy  these babies get juicy!,34.05,100.0,22.78,33.59,80.24,92.08,0.0,
597037, Garlicky Lemon-Marinated Portobello Burgers, antipasti | starter | snack | appetizer | antipasto | hor d'oeuvre, 9g, 41g, 8g, garlic cloves kosher salt fresh lemon juice olive oil pita pockets portobello mushrooms mesclun salad mix sherry wine vinegar <<instructions>> Place the portobello mushroom caps upside down on a baking sheet. Whisk together the olive oil  garlic  lemon juice  and salt  and pour the mixture evenly over the mushrooms. Make sure the marinade pools up in the undersides of the portobellos. Turn them a few times during their bath so that both sides get liberally coated. Marinate for at least 30 minutes at room temperature. Meanwhile  in a small bowl  combine the vinaigrette ingredients and mix well. Set aside. Light a charcoal fire or preheat your gas grill on high. Oil the grill’s cooking surface. Let the coals burn down to a medium-hot fire or adjust the gas grill burners to medium-high. Grill the portobello mushrooms for about 5 minutes per side  longer if you want a slightly crispy crust. Toss the mesclun with the vinaigrette  then place 2 mushroom burgers in each warm pita pocket and top with the dressed mesclun.,20.76,100.0,53.8,55.31,80.96,65.88,0.0,
158335, Curried Eggplant| Lentil| and Quinoa Burgers, antipasti | starter | snack | appetizer | antipasto | hor d'oeuvre, 6g, 25g, 1.27g, agave nectar cooked lentils curry powder eggplant garlic cloves ground coriander ground cumin lemon juice diced onion smoked spicy paprika potato starch quinoa flakes red bell pepper salt smoked paprika <<instructions>> Remove the top of the eggplant and cut it in half lengthwise. Place it cut-sides down on a baking sheet lined with parchment paper or silicon baking mat. Bake for 25 minutes or until the eggplant is completely sunken in and tender. Remove to a shallow dish and allow to cool completely. (You can do this even several days in advance and store in a covered container in the refrigerator.) Once the eggplant is cool  discard any liquid that has accumulated and scrape the flesh from the peel. Place the pulp in a food processor and pulse a few times to make a coarse puree. Transfer to a medium-sized bowl and add the remaining ingredients. Mix very well and allow to stand at room temperature for 20 minutes. Preheat oven to 425 F. Line a baking sheet with parchment paper or silicon baking mat. Heat a large non-stick frying pan over medium-high heat. Once it’s hot  wipe or spray it with a little pan spray or canola oil. Wet your hands and form eggplant mixture into patties about 3 inches wide and 1/2 inch thick. (You can also form the burgers by spooning the mixture into the pan and using the back of a spoon to shape it into patties.) Cook three or four at a time until lightly browned and then carefully flip over and brown the other side. Remove with a spatula and place each burger on the prepared baking sheet. Bake for 15-20 minutes  until burgers are cooked through. Serve with traditional hamburger condiments or with Spicy Onion-Pepper Relish.,35.95,100.0,19.95,37.63,38.62,55.2,0.595,
589724, Red Lentil| Smashed Chickpea and Millet Burgers, antipasti | starter | snack | appetizer | antipasto | hor d'oeuvre, 10g, 35g, 5g, carrot canned dry chickpeas chili powder mixed flax egg gluten free garbanzo bean flour garlic green diced bell pepper ground cumin black ground pepper millet gluten free old fashioned oats olive oil dried oregano raw pepitas red split lentils sea salt whole grain mustard yellow diced onion <<instructions>> In a small saucepan  combine the lentils with 1 cup water. Bring to a boil  reduce to a simmer  and cook for 10-15 minutes  until softened. Drain excess water and transfer to a bowl mixing bowl.You can cook the millet at the same time as the lentils  or use the same pan after the lentils are cooked. Pour the millet into a saucepan over medium heat  and toast for about 5 minutes  until lightly golden. Pour in 1 cup water and ¼ teaspoon salt. Bring to a boil  then reduce heat to low  cover  and simmer for 15 minutes  until most of the liquid is absorbed. Remove from the heat and let sit for 10 minutes. All of the water should be absorbed at this point. Pour the millet into the bowl with the lentils. Heat ½ tablespoon olive oil in a saucepan over medium heat. Add the garlic and cook until fragrant (about 30 seconds)  then add the onions and ¼ teaspoon salt. Cook until the onions are starting to soften  then add the green pepper. Cook for 3-5 minutes  until the green pepper is softened as well. Pour the stir-fried vegetables into the bowl with the lentils and millet  and refrigerate until ingredients are completely cool (at least 30 minutes).Preheat oven to 35 Add all remaining ingredients except the flour and egg (flax or chicken egg) to the bowl with the chilled lentils  millet  and veggies. Stir until the spices are incorporated fully into the mixture  then taste and adjust seasoning to your liking. Mix in the flour  followed by the egg.Shape ½ cup of the mixture into a patty  packing tight with your hands so it sticks together well. Place on a parchment-lined baking sheet. Repeat with remaining patties (you should end up with 7). Bake for 10-12 minutes on each side. After they're done baking  let them sit on the baking sheet for a couple minutes before moving - this will allow them to set up more.You can eat them as-is  but I like to pan fry them to make the outside a little crispy and golden. To do so  just use ½ teaspoon olive oil for each side of each patty (so 1 teaspoon total for each patty). Fry over medium heat for about 3 minutes on each side. Serve on buns (gluten free  if desired)  with your favorite toppings - I like avocado  chopped radicchio  hot sauce  and hummus (bean on bean on bean  I know).,57.49,100.0,12.74,41.85,29.91,91.4,90.2975,
227961, Cajun Spiced Black Bean and Sweet Potato Burgers, antipasti | starter | snack | appetizer | antipasto | hor d'oeuvre, 9g, 35g, 1.23g, canned black beans cajun spice garlic g porridge oats black grinding of pepper spinach sweet potato <<instructions>> Rinse the beans and add them to a mixing bowl. Mash  but leave half of the beans whole for a bit of texture. Scoop the flesh out of the baked potato with a spoon and add to the bowl. Rinse your spinach in a colander then pour a kettleful of boiling water over it to wilt it. Rinse with cold water to refresh  then squeeze as much water out as you can. Chop and add to the bowl. Next add the seeds  oats  spices  garlic and black pepper and mix until well combined. Shape your mixture into 4 hearty balls  then flatten out into burger shapes. Pop the burgers on a plate until you are ready to use them. You can bake or fry them in a little oil. I fried my burger in a little cold pressed rapeseed oil  for a few minutes on each side until brown and crisp. These burgers will also freeze well. Layer them between sheets of greaseproof paper in a tupperware tub and pop in the freezer. Enjoy!,100.0,17.87,0.0,0.0,0.0,50.69,0.0,
