17861, Chinese Chicken Salad Ii, side dish | lunch | main course | salad | main dish | dinner, 23g, 91g, 56g, almonds canned mandarin oranges fresh cilantro leaves napa cabbage red cabbage black salt and pepper sugar asian vinaigrette <<instructions>> ,34.1,100.0,55.12,55.72,50.36,78.89,0.0,
871039, Chicken Avocado Salad with Peanut Dressing, side dish | lunch | main course | salad | main dish | dinner, 27g, 41g, 61g, avocado cucumber garlic clove lime (juice) low sodium soy sauce napa cabbage peanut butter peanut butter peanuts rice vinegar shredded slaw mix <<instructions>> Heat the broiler on your oven to high and place an oven rack 6 inches below. Line a baking sheet with foil.Season the chickenon both sides with the salt  pepper and paprika. Place it on the baking sheet and broil for 7 minutes  the flip and broil for 7 minutes more. While the chicken is broiling  whisk together the honey  vinegar and peanut butter. Brush it on the chicken and broil for 2 more minutes. Flip the chicken one more time  brush with the honey mixture and broil 2 minutes more. Remove the chicken and let it cool slightly.Slice into pieces Combine the cabbage and slaw mix in a large bowl and toss it with a pinch of salt and pepper. Add the chicken on top along with the avocado  cucumber and chopped peanuts. Drizzle on the dressing  toss and serve!peanut dressing Whisk the ingredients together in a large bowl until smooth. This can be stored in the fridge in a sealed container for a few days!,22.37,1.27,0.0,0.0,0.0,100.0,0.0,
516377, Southwest Quinoa Salad, side dish | lunch | main course | salad | main dish | dinner, 22g, 91g, 33g, black beans corn fresh cilantro jalepeño naturebox chili lime pistachios olive oil white quinoa red bell pepper red onion salt and pepper water <<instructions>> Bring 2 cups of water to boil in a medium pot. Add quinoa and cover.Lower the heat and simmer for about 25 minutes  until all of the water is absorbed.In the mean time  add olive oil  lime juice  jalapeño  salt and pepper to a salad dressing cruet or small bowl and shake or whisk together well. Place the dressing in the refrigerator to chill.Once done  remove the lid and allow quinoa to cool for about 15 minutes. Add pistachios  black beans  red bell pepper  corn  red onion and cilantro. Drizzle with chili lime vinaigrette and toss everything together.,34.41,100.0,50.86,75.02,44.15,79.89,1.685,
1109227, Broccoli Edamame Salad, side dish | lunch | main course | salad | main dish | dinner, 20g, 48g, 15g, swiss chard red cabbage cooked crowns of broccoli cooked edamame sesame seeds lime (juice) garlic olive oil red wine vinegar maple syrup crushed red pepper flakes salt and pepper <<instructions>> Wash the swiss chard and chop it into bite-sized pieces. Place into a large bowl. Add 1 tbsp of olive oil and the juice of one lime. Use your hands to work the oil and lime into the chard. Add the minced garlic  lightly steamed broccoli and finely chopped cabbage to the bowl with the chard. Cook the edamame according to package instructions. Drain and add to the bowl with the rest of the ingredients. Add the sesame seeds  maple syrup  red wine vinegar  red pepper flakes and salt and pepper to taste. Mix well. Serve right away or store in the fridge up to 3 days.,27.06,100.0,54.76,83.53,49.09,54.05,0.0,
1118180, The best healthy salad, side dish | lunch | main course | salad | main dish | dinner, 22g, 74g, 59g, strawberries canned chickpeas big avocado spinach almonds sunmagic orange juice extra virgin oil lemon juice maple syrup dijon mustard salt and pepper <<instructions>> First roast the flaked almonds slightly in the oven; 10 minutes on 200 degrees In a medium bowl add the spinach  halved strawberries  chickpeas and avocado For the dressing combine all ingredients in an empty jar and shake well to make sure it all mixes together Pour the juice dressing over and toss to combine Top with the roasted almonds and enjoy immediately,100.0,8.17,69.55,24.47,5.29,62.02,90.0,
580715, Heart of Romaine Salad with Pico de Gallo and Avocado Dressing, side dish | lunch | main course | salad | main dish | dinner, 21g, 63g, 13g, avocado cherry tomatoes chili powder cooked black beans or cumin powder garlic hearts of romaine jalapeño lime (juice) olive oil optional garnishes: pepitas purple onion red onion red pepper flakes salt sherry vinegar water white wine vinegar <<instructions>> Make the pico de gallo: in a medium bowl  toss together all of the ingredients and set aside to marinate.Make the dressing: in a food processor or quality blender  combine the avocado flesh  lime juice  cilantro  red pepper flakes and salt. Blend while drizzling in the water and olive oil. Continue to blend until the dressing is smooth and creamy.Warm the beans: in a large skillet  heat a drizzle of olive oil over medium heat. Sauté the onion and garlic for a couple of minutes  then add the cumin and sauté for another minute. Pour in one can of black beans with all of its cooking liquid  then drain the other can  reserving the juices for later if necessary. Pour the remaining beans into the pan and stir in the chili powder and cayenne pepper.Turn up the heat to medium-high and simmer the beans for 7 to 10 minutes. Use a fork or the back of a wooden spoon to mash up about ½ of the beans. Reduce heat as necessary and add more of the cooking liquid if the mixture seems too dry. Remove the beans from heat and stir in the sherry vinegar and salt  to taste.To serve  place a generous amount of beans on a salad plate  then top the beans with a romaine halve. Spread several spoonfuls of avocado sauce over the romaine and top it with lots of pico de gallo. Garnish with toasted pepitas or crumbled feta cheese  if you'd like.,76.72,35.94,100.0,28.58,23.49,67.14,7.35,
615615, Spicy Udon Noodle Salad, side dish | lunch | main course | salad | main dish | dinner, 25g, 82g, 34g, head of cauliflower grape seed oil green onions lime peanut butter red bell pepper sesame oil soy sauce sriracha chili sauce udon noodles <<instructions>> Cook udon noodles according to package instructions but DO NOT use the spice packet (throw it away). Drain noodles and allow to cool. Whisk together sauce ingredients in a mediumbowl. Toss together all vegetables  noodles and noodle sauce. Chill in the refrigerator for at least 20 minutes before serving with lime.,59.83,30.98,39.95,57.42,58.91,100.0,1.435,
213346, Grilled-Vegetable Salad with Lentils, side dish | lunch | main course | salad | main dish | dinner, 21g, 54g, 15g, trimmed asparagus spears bay leaf black pepper dried lentils eggplant garlic clove dried herbes de provence olive oil olive oil orange bell pepper red bell pepper red onion red wine vinegar red wine vinegar salt walnuts water yellow bell pepper zucchini fresh dried or <<instructions>> Prepare grill. To prepare lentils  rinse and drain lentils. Place water  lentils  and bay leaf in a medium saucepan; bring to a boil. Reduce heat and simmer 20 minutes. Drain; discard bay leaf. Combine lentils  red onion  and next 7 ingredients (through garlic) in a large bowl. To prepare vegetables  combine asparagus and next 6 ingredients (through oil) in a large bowl; toss well to coat. Grill zucchini  peppers  and eggplant 15 minutes  turning once. Grill asparagus 6 minutes  turning once. Place vegetables in a bowl; drizzle with 2 teaspoons vinegar. Sprinkle with remaining ingredients; toss well to coat. Serve with lentils.,32.76,100.0,22.72,57.25,35.08,54.98,1.11,
802281, Quinoa Herb Greek Salad with White Beans, side dish | lunch | main course | salad | main dish | dinner, 20g, 78g, 17g, basil canned white beans cucumber lemon (juice) kalamata olives mint olive oil parsley quinoa u radishes red onion salt and pepper tomatoes <<instructions>> Cook the quinoa according to package directions. You can make this salad with warm or cooled quinoa. Toss everything together with the quinoa. Whisk together lemon juice  olive oil  salt  and pepper. Drizzle over the salad.,57.9,76.3,100.0,53.34,46.36,64.1,0.0,
1109848, Vegan Lentil Kale Salad with Roasted Broccoli, side dish | lunch | main course | salad | main dish | dinner, 23g, 48g, 20g, de-stemmed and kale olive oil broccoli salt and pepper cooked french dry black green lentils tahini fresh lemon juice water garlic powder sea salt pepper cumin <<instructions>> Pre-heat the oven to 425 degrees. Add the lentils to a medium-sized saucepan with 2.25 cups water. Bring to a boil  then cover and reduce to a light simmer. Cook for 20-25 minutes until tender. Drain off any excess water if needed. Place the chopped broccoli on a roasting pan and drizzle with 1 tbsp of olive oil or avocado oil. Sprinkle with sea salt. Use your hands to mix  making sure each piece is coated. Roast in the oven for 20-25 minutes until tender and starting to brown. Place the chopped kale in a bowl and add the other 1 tbsp of olive oil or avocado oil. Use your hands to massage for a few minutes until its wilted  dark green and soft. To make the tahini sauce  add all the ingredients to a bowl or container and whisk until smooth and creamy. To assemble the salad  divide the ingredients between 4 bowls or containers  top with the tahini sauce  a squeeze of fresh lemon juice and a sprinkle of sea salt and black pepper and serve right away or store in the fridge for up to 5 days.,26.23,100.0,60.14,83.09,42.28,73.36,0.0,
10039, Quick Soba Noodle Salad With Coconutty Boy Choy, side dish | lunch | main course | salad | main dish | dinner, 20g, 62g, 16g, canned baby bok choy canola oil coconut oil block of extra tofu fresh ginger garlic honey lemon (juice) rice wine vinegar sesame oil dried soba noodles soy sauce squirt of sriracha <<instructions>> ,63.09,16.4,51.72,47.51,71.03,100.0,6.0,
38621, Chopped Vegetable Salad With Lemon-garlic Dressing, side dish | lunch | main course | salad | main dish | dinner, 24g, 98g, 59g, another favorite oil dijon mustard garlic fresh lemon juice mixed vegetables and other additions sea salt <<instructions>> ,36.92,100.0,40.67,54.62,27.82,96.89,15.0,
20692, Spring Wheat Berry Salad, side dish | lunch | main course | salad | main dish | dinner, 27g, 110g, 21g, fresh chervil coarse salt and pepper fava beans fresh mint leaves fresh peas lemon (juice) olive oil pea shoots salad greens baby turnips wheat berries <<instructions>> ,59.11,81.75,57.48,49.37,51.08,100.0,0.0,
485520, Radish Mint Noodle Salad, side dish | lunch | main course | salad | main dish | dinner, 27g, 64g, 9g, black vinegar mint leaves radishes sesame oil sesame seeds soy sauce cooked mung bean noodles <<instructions>> Remove roots and leaves from the radishes and discard.  Wash and thinly slice the radishes. Rinse the mint leaves (if needed) and tear into small pieces. Divide the noodles among 4 small bowls (for a side dish) or two bowls (for a main dish). Whisk together soy sauce  sesame oil and vinegar and pour over noodles. Arrange radish slices and mint in each bowl of noodles and sprinkle with sesame seeds. To eat  mix well to make sure everything is well coated in dressing.,27.17,9.22,4.81,8.5,2.98,100.0,0.0,
23136, Chopped Tusanesque Salad, side dish | lunch | main course | salad | main dish | dinner, 22g, 88g, 24g, avocado basil bread canned cannellini beans cherry tomatoes cucumber olive oil red bell pepper red onion red wine vinegar sea salt <<instructions>> ,74.89,21.27,59.72,15.18,13.93,100.0,0.37,
27720, Soba Noodle & Tofu Salad For 2, side dish | lunch | main course | salad | main dish | dinner, 24g, 59g, 39g, chioggia beet cherry tomatoes edamame beans extra virgin olive oil fresh ginger fresh herbs lime (juice) melon rice vinegar salt & pepper sesame oil sesame seeds buckwheat soba noodles sprouts tofu zucchini broccolinis <<instructions>> ,43.06,54.58,35.14,29.38,46.04,100.0,42.0,
760396, No-Cook Cannellini Salad with Pesto Dressing, side dish | lunch | main course | salad | main dish | dinner, 21g, 64g, 4g, cooked basil pesto canned cannellini beans capers green onions red shredded cabbage <<instructions>> Combine all ingredients in large bowl. Let stand 15 to 30 minutes to allow flavors to meld. Serve at room temperature.,14.65,100.0,55.95,56.56,51.12,64.33,0.0,
987368, Vegan Quinoa Fiesta Salad, side dish | lunch | main course | salad | main dish | dinner, 21g, 83g, 32g, diced avocado diced bell peppers black beans chili powder chipotle peppers in adobo plus 2 tsp of the adobo sauce cooked quinoa corn kernels cumin fresh cilantro fresh cilantro garlic diced green onion lemon juice fresh lime juice maple syrup raw cashews shredded romaine lettuce sea salt sea salt tempeh diced fresh tomato tortilla chips water <<instructions>> Cook the Quinoa. Cook the quinoa according to package instructions. I cooked 1 cup dry which made 3 cups cooked  or enough for 4 large burrito bowls. Once cooked  mix with cilantro  lime  chili powder  garlic powder  paprika and sea salt.Make the Chipotle Sauce. Add all the sauce ingredients to a high-speed blender and mix until smooth and creamy.Assemble the Fiesta Salad. To assemble the salad  start with some romaine lettuce then top with the rest of the ingredients  including 3/4 cup of cooked quinoa  drizzle with a generous amount of the chipotle sauce and enjoy.,74.51,71.09,100.0,48.04,40.14,85.76,338.99,
1105450, Warm Potato Arugula Salad with Tempeh, side dish | lunch | main course | salad | main dish | dinner, 21g, 63g, 15g, tempeh soy sauce balsamic vinegar another sweetener salt fresh arugula baby potatoes salt red a onion tahini water red fresh lemon juice garlic powder dijon mustard maple syrup sea salt black pepper <<instructions>> Start by adding the cubed tempeh and marinade ingredients to a small dish  mixing well and marinating for 30 minutes up to overnight. When youre ready to make the salad  bring a large pot of water to a boil on the stovetop with 1-2 tsp of salt. Add the baby potatoes and cook for approximately 15 minutes until easily pierced with a fork. Strain. While the potatoes are cooking  turn the oven on to broil. Place the cubed tempeh on a baking sheet and broil for 10 minutes until starting to brown and crisp. To make the dressing  whisk the ingredients together in a jar or dish until smooth and creamy. To assemble the salads  start with a bed of arugula then evenly divide the cooked potatoes  tempeh and red onion amongst each serving. Drizzle with the dressing and enjoy.,25.4,100.0,9.85,11.83,23.08,77.54,90.0,
92984, Tidbit Raw Vegetable Salad With Toasted Seeds, side dish | lunch | main course | salad | main dish | dinner, 26g, 53g, 39g, broccoli carrots cauliflower celery cucumber fresh basil green bell pepper olive oil onion radish red bell pepper red green cabbage salt and pepper seasoning salt sesame seeds snap peas spinach raw unsalted raw sunflower seeds raw unsalted raw pumpkin seeds <<instructions>> Slice  dice  grate and mince all vegetables until they are all in tiny bite size pieces  and toss together in a large bowl. Heat the olive oil in a large pan.Season the pumpkin  sunflower and seasame seeds with the seasoned salt.pan fry the seeds in olive oil and cool on a paper towel.Toss the seeds with the salad.serve with your favorite dressing.,69.94,93.44,47.34,100.0,36.22,69.33,1.19,
607673, Fiery Fruit & Quinoa Salad from Salad Samurai, side dish | lunch | main course | salad | main dish | dinner, 23g, 102g, 26g, agave nectar chia seeds chipotle chiles in adobo sauce cooked black beans ears of corn garlic ground cumin fresh lightly lime juice nectarines olive oil orange juice pumpkin seeds cooked red confetti quinoa red onion salt <<instructions>> Whisk together all of the dressing ingredients in a glass or plastic measuring cup. Cover and chill for 10 minutes or overnight to plump up the chia seeds. Pour the quinoa  beans  and fresh herbs into a large mixing bowl. Keep this mixture chilled while you grill the remaining ingredients.Preheat a cast-iron grill pan over medium-high heat  or heat an outdoor grill as per manufacturer's directions. Rub the fruit and veggies with a thin coating of olive oil and sprinkle with a pinch of salt. Grill the onions until browned  about 3 minutes; set aside. Grill the peaches on each side for about 2 minutes  until the outside is hot and slightly charred; set aside. Grill the ears of corn until the kernels are lightly charred  turning the cobs occasionally  3 to 4 minutes. Cool the vegetables and fruit just enough to be handled safely  then dice into bite-sized pieces. Use a knife with a thin blade to slice the corn kernels off the cobs. Transfer the chopped fruit and veggies to the bowl with the quinoa  add the pumpkin seeds  and then pour on the dressing and toss thoroughly. Serve at room temperature or chilled.,100.0,57.48,76.47,43.7,36.16,59.3,112.5,
469788, Carrot and Rye Berry Salad with Celery| Cilantro| and Marcona Almonds, side dish | lunch | main course | salad | main dish | dinner, 21g, 86g, 31g, marcona almonds bay leaves black pepper carrots celery whole dijon mustard fresh cilantro leaves garlic clove kosher salt juice from 1 lemon olive oil red onion dried rye berries sherry vinegar <<instructions>> Place rye berries in a medium saucepan and cover with water by 2 inches. Add 1 bay leaf and season heavily with salt. Bring to a boil  reduce to a simmer  and cook until rye berries are tender  about 30 minutes. Drain in a fine mesh strainer and run under cool water until well chilled. Discard bay leaf. Place strainer over a large bowl and let drain for at least 15 minutes. While rye berries cook  place carrots and remaining bay leaf bay leaf in a large saucepan and cover with cold water by 1 inch. Season heavily with salt. Bring to a boil over high heat  reduce to a simmer  and cook until tender  about 10 minutes. Drain under cold running water and peel by rubbing skin off under running water. Cut carrots into 1- to 1/2-inch chunks on a bias. Set aside. Toast almonds in a medium skillet over medium heat  tossing frequently  until nutty brown and dark in spots  about 5 minutes. Transfer to a bowl and set aside. Combine mustard  garlic  lemon juice  vinegar  and olive oil in a large bowl and whisk to combine. Add drained rye berries  carrots  almonds  celery  onion  and cilantro. Season to taste with salt and pepper. Toss gently with your hands until the salad is coated in the dressing. Serve immediately or store in a sealed container for up to 3 days.,100.0,47.21,16.63,62.96,0.41,39.84,60.0,
631007, Red Kuri & Beet Kale Salad with Cranberry Orange Balsamic Dressing & Pecan Parmesan, side dish | lunch | main course | salad | main dish | dinner, 21g, 94g, 62g, balsamic vinegar cinnamon coconut sugar dried rosemary garlic green apple lemon (juice) kale nutmeg nutritional yeast olive oil orange juice raw pecan pieces red beets red kuri squash salt and pepper fresh cranberies <<instructions>> Preheat the oven to 40 Line two baking sheets with parchment paper. On one baking sheet  spread out the red kuri squash cubes  and on the other  spread out the beet cubes. Lightly spray each with olive oil spray (or drizzle with a bit of olive oil). Sprinkle the cinnamon and nutmeg over the red kuri squash and the rosemary over the beets. Salt and pepper both to taste  then toss to fully coat. Place both sheets in the oven and bake for 30 minutes  tossing halfway through to ensure even cooking. Once the vegetables are done baking remove from oven and let cool for 5-10 minutes.While the vegetables are cooking  place your kale in a large bowl and drizzle the lemon juice and 1 teaspoon of olive oil over it. Spend about 5 minutes rubbing the lemon juice and olive oil into the kale  massaging it  if you will. Set aside- the lemon juice will continue to break down the fibers in the kale leaves and make it a bit softer. Add your apple slices and veggies to the bowl of kale and toss to combine. To serve  place a bit of the salad on a plate/in a bowl  drizzle some cranberry orange balsamic dressing on top and sprinkle with pecan parmesan. Serve immediately. Enjoy! Combine the orange juice and coconut sugar  letting the sugar dissolve  in a small saucepan and bring to a boil. Once it is boiling  lower to a simmer and add the cranberries. Once the cranberries begin to pop  after a few minutes  add the balsamic vinegar and lower the heat to a dull simmer. Let cook  stirring occasionally  for about 5-7 minutes. Remove from heat and chill until ready to use. Enjoy! Combine all of the parmesan ingredients in the bowl of a food processor and pulse until it has a crumbly texture with tiny pieces of pecan. Do not overprocess- You do not want a flour-like or nut butter-type consistency. Pour the pecan parmesan into a bowl and chill until ready to use. Enjoy!,100.0,4.1,75.26,41.71,7.68,86.74,0.0,
1087653, Radish| lentil & mint salad, side dish | lunch | main course | salad | main dish | dinner, 29g, 69g, 20g, walnut pieces olive oil red onion black treacle sherry vinegar pack mint canned green lentils cucumber red whole radishes <<instructions>> Toast the walnut pieces in a large frying pan over a medium heat until fragrant and just starting to char at the edges. Tip into a bowl and set aside. In the same pan  turn the heat down to low and add 1 tbsp olive oil. Add the onion  fry gently for around 10 mins until soft  then take the pan off the heat. Add the black treacle  Sherry vinegar and the rest of the olive oil  then mix and leave to cool. Add the chopped mint to the pan  and season well. In a large bowl  mix together the lentils  cucumber and half the radishes  then pour over the cooled onion and mint dressing. Toss everything together and pile onto a serving dish. Scatter over the walnut pieces and the rest of the mint and radishes  then serve.,36.29,100.0,23.99,52.12,46.33,68.55,0.0,
1104959, Broccoli Pesto Quinoa Salad, side dish | lunch | main course | salad | main dish | dinner, 26g, 70g, 46g, broccolini kale leaves olive oil lemon (juice) cooked quinoa red watermelon radish avocado fresh mixed herbs roasted chickpeas black sea salt and pepper hemp seeds frozen peas garlic clove sea salt fresh spinach fresh dill fresh lemon juice dijon mustard olive oil <<instructions>> Prepare a large pot of salted boiling water and a large bowl of ice water. Drop the broccolini into the boiling water and blanch for about 1 minute  or until tender but still vibrant green. Transfer the broccolini to the ice water for 1 minute to stop the cooking process. Drain and set aside. Make the Lemony pea pesto: In a food processor  place the hemp seeds  peas  garlic  and salt and pulse until combined. Add the spinach  dill  lemon juice  and mustard and pulse again. While the processor is running  drizzle in the olive oil. For a thinner pesto  add more olive oil until it reaches your desired consistency. Taste and adjust seasonings. Place the kale into a large bowl and drizzle with olive oil  pinches of salt and pepper  and the lemon juice. Massage the leaves until they soften and wilt down. Portion into serving bowls with the quinoa  watermelon radish  avocado  herbs  and broccolini. Season to taste with additional olive oil  lemon juice  salt and pepper. Add the roasted chickpeas and serve with dollops of pea pesto.,38.66,86.64,68.35,60.17,51.32,100.0,15.0,
99273, Mediterranean Chopped Salad, side dish | lunch | main course | salad | main dish | dinner, 23g, 52g, 37g, roasted almonds canned chickpeas coarse salt and ground pepper grainy mustard red oil-packed roasted peppers olive oil orange bell pepper romaine lettuce white-wine vinegar <<instructions>> ,38.67,26.83,0.0,0.0,0.0,100.0,60.945,
221130, Soba noodle & edamame salad with grilled tofu, side dish | lunch | main course | salad | main dish | dinner, 21g, 52g, 7g, soba noodles fresh edamame beans shredded spring onions beansprouts cucumber dry block tofu oil fresh coriander leaves mirin tamari orange juice red chilli <<instructions>> Heat dressing ingredients in your smallest saucepan  simmer for 30 secs  then set aside. Boil noodles following the pack instructions  adding the edamame beans for the final 2 mins cooking time. Rinse under very cold water  drain thoroughly and tip into a large bowl with the spring onions  beansprouts  cucumber  sesame oil and warm dressing. Season if you like. Brush tofu with the veg oil  season and griddle or grill for 2-3 mins each side  the tofu is very delicate so turn carefully. Top the salad with the tofu  scatter with coriander and serve,100.0,12.31,37.72,31.71,47.94,64.25,337.5,
32477, Early Summer Vegetable Salad, side dish | lunch | main course | salad | main dish | dinner, 32g, 104g, 4g, dill ears corn fava beans green beans lemon zest english peas black sea salt and cracked pepper snap peas <<instructions>> ,44.14,100.0,50.8,47.67,61.51,47.01,0.0,
31755, Mediterranean Garbanzo Salad, side dish | lunch | main course | salad | main dish | dinner, 24g, 68g, 17g, cooked italian balsamic vinaigrette black olives canned garbanzo beans grape tomatoes black ground pepper lemon juice parsley yellow squash <<instructions>> ,47.08,48.7,100.0,52.77,20.98,58.73,0.0,
496192, Black Bean and Spinach Salad, side dish | lunch | main course | salad | main dish | dinner, 30g, 103g, 6g, avocado oil baby spinach cherry tomatoes cooked dried black beans frozen corn garlic orange (juice) pomegranate molasses salt shallot yellow bell pepper <<instructions>> Throw everything in the bowl and mix.,100.0,26.7,77.81,21.69,17.45,63.7,0.595,
