647830, 716195, 0.47982883613670635, Indian Lentil Dahl, Spicy Indian-Style Hummus
647830, 636901, 0.6216769846454205, Indian Lentil Dahl, Cannellini Bean Side Dish With Fennel| Red Onion| and Saffron
647830, 766453, 0.5811993133868691, Indian Lentil Dahl, Hummus and Za'atar
647830, 795431, 0.5013267667208431, Indian Lentil Dahl, Green Bean Poriyal
716195, 636901, 0.2347194600614638, Spicy Indian-Style Hummus, Cannellini Bean Side Dish With Fennel| Red Onion| and Saffron
716195, 766453, 0.4926745335247841, Spicy Indian-Style Hummus, Hummus and Za'atar
716195, 795431, 0.7395393678439892, Spicy Indian-Style Hummus, Green Bean Poriyal
636901, 766453, 0.6099581855232958, Cannellini Bean Side Dish With Fennel| Red Onion| and Saffron, Hummus and Za'atar
636901, 795431, 0.3636769102237833, Cannellini Bean Side Dish With Fennel| Red Onion| and Saffron, Green Bean Poriyal
766453, 795431, 0.33456222036274885, Hummus and Za'atar, Green Bean Poriyal
